{
  "name": "FigS2d_adjacent_per_run",
  "max_row": 16,
  "max_column": 7,
  "rows": [
    [
      "protocol",
      "seed",
      "n_queries",
      "n_errors",
      "n_adjacent_errors",
      "top1_percent",
      "adjacent_error_percent"
    ],
    [
      "H0",
      41,
      540,
      63,
      32,
      88.33333333333333,
      50.79365079365079
    ],
    [
      "H0",
      581,
      540,
      74,
      47,
      86.29629629629629,
      63.51351351351352
    ],
    [
      "H0",
      1121,
      540,
      72,
      42,
      86.66666666666667,
      58.33333333333334
    ],
    [
      "H0",
      1661,
      540,
      68,
      41,
      87.4074074074074,
      60.29411764705883
    ],
    [
      "H0",
      2201,
      540,
      69,
      44,
      87.22222222222223,
      63.76811594202898
    ],
    [
      "H2",
      41,
      540,
      126,
      94,
      76.66666666666667,
      74.60317460317461
    ],
    [
      "H2",
      581,
      540,
      130,
      101,
      75.92592592592592,
      77.6923076923077
    ],
    [
      "H2",
      1121,
      540,
      122,
      91,
      77.4074074074074,
      74.59016393442623
    ],
    [
      "H2",
      1661,
      540,
      138,
      111,
      74.44444444444444,
      80.43478260869566
    ],
    [
      "H2",
      2201,
      540,
      132,
      106,
      75.55555555555556,
      80.3030303030303
    ],
    [
      "H8",
      41,
      540,
      209,
      156,
      61.2962962962963,
      74.64114832535886
    ],
    [
      "H8",
      581,
      540,
      222,
      166,
      58.88888888888889,
      74.77477477477477
    ],
    [
      "H8",
      1121,
      540,
      213,
      159,
      60.55555555555556,
      74.64788732394366
    ],
    [
      "H8",
      1661,
      540,
      225,
      172,
      58.33333333333334,
      76.44444444444444
    ],
    [
      "H8",
      2201,
      540,
      217,
      172,
      59.81481481481482,
      79.26267281105991
    ]
  ],
  "cell_types": [
    [
      "s",
      "s",
      "s",
      "s",
      "s",
      "s",
      "s"
    ],
    [
      "s",
      "n",
      "n",
      "n",
      "n",
      "n",
      "n"
    ],
    [
      "s",
      "n",
      "n",
      "n",
      "n",
      "n",
      "n"
    ],
    [
      "s",
      "n",
      "n",
      "n",
      "n",
      "n",
      "n"
    ],
    [
      "s",
      "n",
      "n",
      "n",
      "n",
      "n",
      "n"
    ],
    [
      "s",
      "n",
      "n",
      "n",
      "n",
      "n",
      "n"
    ],
    [
      "s",
      "n",
      "n",
      "n",
      "n",
      "n",
      "n"
    ],
    [
      "s",
      "n",
      "n",
      "n",
      "n",
      "n",
      "n"
    ],
    [
      "s",
      "n",
      "n",
      "n",
      "n",
      "n",
      "n"
    ],
    [
      "s",
      "n",
      "n",
      "n",
      "n",
      "n",
      "n"
    ],
    [
      "s",
      "n",
      "n",
      "n",
      "n",
      "n",
      "n"
    ],
    [
      "s",
      "n",
      "n",
      "n",
      "n",
      "n",
      "n"
    ],
    [
      "s",
      "n",
      "n",
      "n",
      "n",
      "n",
      "n"
    ],
    [
      "s",
      "n",
      "n",
      "n",
      "n",
      "n",
      "n"
    ],
    [
      "s",
      "n",
      "n",
      "n",
      "n",
      "n",
      "n"
    ],
    [
      "s",
      "n",
      "n",
      "n",
      "n",
      "n",
      "n"
    ]
  ],
  "number_formats": {},
  "merged_ranges": [],
  "sheet_state": "visible",
  "freeze_panes": null,
  "header_rows": [
    1
  ],
  "row_policy": "All rows within worksheet dimensions, including blank and note rows, are retained.",
  "column_widths": {},
  "row_heights": {}
}
