{
  "name": "Fig7a_TableS8b",
  "max_row": 8,
  "max_column": 5,
  "rows": [
    [
      "Ground-truth leak model",
      "Corpus",
      "Partition Top-1 (%)",
      "Exact-junction rate (%)",
      "Median distance (coordinate units)"
    ],
    [
      "Emitter α = 0.5",
      "Prescribed demand (Cd)",
      85,
      30,
      108
    ],
    [
      "Emitter α = 0.5",
      "Emitter α = 0.5 (Ce)",
      86.7,
      38.3,
      71
    ],
    [
      "Emitter α = 1.0",
      "Prescribed demand (Cd)",
      86.7,
      28.3,
      138
    ],
    [
      "Emitter α = 1.0",
      "Emitter α = 0.5 (Ce)",
      86.7,
      38.3,
      88
    ],
    [
      "Emitter α = 1.5",
      "Prescribed demand (Cd)",
      86.7,
      30,
      131
    ],
    [
      "Emitter α = 1.5",
      "Emitter α = 0.5 (Ce)",
      85,
      36.7,
      74
    ],
    [
      "Prescribed demand (control)",
      "Prescribed demand (Cd)",
      86.7,
      "–",
      "–"
    ]
  ],
  "cell_types": [
    [
      "s",
      "s",
      "s",
      "s",
      "s"
    ],
    [
      "s",
      "s",
      "n",
      "n",
      "n"
    ],
    [
      "s",
      "s",
      "n",
      "n",
      "n"
    ],
    [
      "s",
      "s",
      "n",
      "n",
      "n"
    ],
    [
      "s",
      "s",
      "n",
      "n",
      "n"
    ],
    [
      "s",
      "s",
      "n",
      "n",
      "n"
    ],
    [
      "s",
      "s",
      "n",
      "n",
      "n"
    ],
    [
      "s",
      "s",
      "n",
      "s",
      "s"
    ]
  ],
  "number_formats": {},
  "merged_ranges": [],
  "sheet_state": "visible",
  "freeze_panes": null,
  "header_rows": [
    1
  ],
  "row_policy": "All rows within worksheet dimensions, including blank and note rows, are retained.",
  "column_widths": {},
  "row_heights": {}
}
