{
  "name": "Fig4d_destination",
  "max_row": 4,
  "max_column": 9,
  "rows": [
    [
      "protocol",
      "correct_pct",
      "adjacent_error_pct",
      "nonadjacent_error_pct",
      "correct_sd",
      "adjacent_error_sd",
      "nonadjacent_error_sd",
      "n_runs",
      "queries_per_run"
    ],
    [
      "H0",
      87.18518518518519,
      7.629629629629631,
      5.185185185185185,
      0.7790994062208371,
      1.042643574834019,
      0.4536092116265143,
      5,
      540
    ],
    [
      "H2",
      76,
      18.62962962962963,
      5.370370370370371,
      1.123388954674304,
      1.530441000844029,
      0.4721314364437762,
      5,
      540
    ],
    [
      "H8",
      59.77777777777779,
      30.55555555555556,
      9.666666666666668,
      1.202991242141609,
      1.360827634879543,
      0.7790994062208378,
      5,
      540
    ]
  ],
  "cell_types": [
    [
      "s",
      "s",
      "s",
      "s",
      "s",
      "s",
      "s",
      "s",
      "s"
    ],
    [
      "s",
      "n",
      "n",
      "n",
      "n",
      "n",
      "n",
      "n",
      "n"
    ],
    [
      "s",
      "n",
      "n",
      "n",
      "n",
      "n",
      "n",
      "n",
      "n"
    ],
    [
      "s",
      "n",
      "n",
      "n",
      "n",
      "n",
      "n",
      "n",
      "n"
    ]
  ],
  "number_formats": {},
  "merged_ranges": [],
  "sheet_state": "visible",
  "freeze_panes": null,
  "header_rows": [
    1
  ],
  "row_policy": "All rows within worksheet dimensions, including blank and note rows, are retained.",
  "column_widths": {},
  "row_heights": {}
}
