{
  "name": "Fig4bc_TableS2a_90q",
  "max_row": 12,
  "max_column": 6,
  "rows": [
    [
      "Method",
      "H0",
      "H2",
      "H3",
      "H4",
      "H8"
    ],
    [
      "Projection residual",
      "86.7 ± 2.6",
      "76.4 ± 2.4",
      "85.8 ± 1.4",
      "71.3 ± 2.7",
      "58.7 ± 3.5"
    ],
    [
      "Cosine 1-NN",
      "86.7 ± 2.6",
      "76.4 ± 2.4",
      "85.8 ± 1.4",
      "71.3 ± 2.7",
      "58.7 ± 3.5"
    ],
    [
      "Cosine k-NN (k=5)",
      "86.7 ± 1.8",
      "74.7 ± 1.8",
      "86.0 ± 2.3",
      "70.9 ± 4.0",
      "54.4 ± 2.8"
    ],
    [
      "Random Forest (100 trees)",
      "85.6 ± 3.4",
      "56.7 ± 4.3",
      "29.6 ± 4.0",
      "32.0 ± 3.1",
      "16.0 ± 2.6"
    ],
    [
      "SVM (RBF)",
      "27.8 ± 0.0",
      "5.6 ± 0.0",
      "25.6 ± 0.0",
      "25.6 ± 0.0",
      "4.4 ± 0.0"
    ],
    [
      "MLP (128,64)",
      "33.3 ± 8.3",
      "9.1 ± 2.5",
      "18.7 ± 4.3",
      "17.3 ± 5.8",
      "4.7 ± 2.4"
    ],
    [
      "Nearest Centroid",
      "23.3 ± 0.0",
      "22.2 ± 0.0",
      "22.2 ± 0.0",
      "20.4 ± 0.6",
      "21.1 ± 0.0"
    ],
    [
      "Logistic Regression",
      "67.1 ± 1.7",
      "19.8 ± 0.9",
      "64.2 ± 1.6",
      "64.2 ± 0.5",
      "14.4 ± 0.0"
    ],
    [
      "GCN+",
      "58.9 ± 4.6",
      "14.9 ± 2.2",
      "45.3 ± 3.3",
      "47.3 ± 3.4",
      "6.2 ± 1.0"
    ],
    [
      "GAT+",
      "58.7 ± 7.2",
      "36.4 ± 8.3",
      "46.4 ± 4.8",
      "52.7 ± 3.8",
      "12.7 ± 1.5"
    ],
    [
      "GraphSAGE+",
      "71.3 ± 4.9",
      "36.0 ± 3.0",
      "60.7 ± 2.9",
      "60.4 ± 2.7",
      "20.0 ± 2.6"
    ]
  ],
  "cell_types": [
    [
      "s",
      "s",
      "s",
      "s",
      "s",
      "s"
    ],
    [
      "s",
      "s",
      "s",
      "s",
      "s",
      "s"
    ],
    [
      "s",
      "s",
      "s",
      "s",
      "s",
      "s"
    ],
    [
      "s",
      "s",
      "s",
      "s",
      "s",
      "s"
    ],
    [
      "s",
      "s",
      "s",
      "s",
      "s",
      "s"
    ],
    [
      "s",
      "s",
      "s",
      "s",
      "s",
      "s"
    ],
    [
      "s",
      "s",
      "s",
      "s",
      "s",
      "s"
    ],
    [
      "s",
      "s",
      "s",
      "s",
      "s",
      "s"
    ],
    [
      "s",
      "s",
      "s",
      "s",
      "s",
      "s"
    ],
    [
      "s",
      "s",
      "s",
      "s",
      "s",
      "s"
    ],
    [
      "s",
      "s",
      "s",
      "s",
      "s",
      "s"
    ],
    [
      "s",
      "s",
      "s",
      "s",
      "s",
      "s"
    ]
  ],
  "number_formats": {},
  "merged_ranges": [],
  "sheet_state": "visible",
  "freeze_panes": null,
  "header_rows": [
    1
  ],
  "row_policy": "All rows within worksheet dimensions, including blank and note rows, are retained.",
  "column_widths": {},
  "row_heights": {}
}
