{
  "name": "Fig5b_TableS3c_pairwise",
  "max_row": 11,
  "max_column": 17,
  "rows": [
    [
      "first",
      "second",
      "group",
      "protocol",
      "metric",
      "median",
      "q1",
      "q3",
      "mean",
      "sample_sd",
      "positive",
      "negative",
      "ties",
      "non_tied_n",
      "p_two_sided_exact",
      "test",
      "p_holm_sensitivity_family_10_G2_H0_top1"
    ],
    [
      "A_prime",
      "A",
      "G2",
      "H0",
      "top1",
      0,
      -0.277777777777775,
      0.8333333333333357,
      0.2592592592592609,
      1.42208994093819,
      7,
      4,
      4,
      11,
      0.548828125,
      "paired exact sign test; ties omitted; unadjusted",
      0.847900390625
    ],
    [
      "C60",
      "A",
      "G2",
      "H0",
      "top1",
      10.00000000000001,
      3.333333333333329,
      13.05555555555556,
      9.148148148148149,
      7.270493951893967,
      13,
      2,
      0,
      15,
      0.00738525390625,
      "paired exact sign test; ties omitted; unadjusted",
      0.05169677734375
    ],
    [
      "C90",
      "A",
      "G2",
      "H0",
      "top1",
      12.22222222222223,
      8.333333333333336,
      15.55555555555556,
      12.14814814814815,
      6.967000405497749,
      15,
      0,
      0,
      15,
      6.103515625e-05,
      "paired exact sign test; ties omitted; unadjusted",
      0.0006103515625
    ],
    [
      "B",
      "A",
      "G2",
      "H0",
      "top1",
      8.8888888888889,
      5,
      12.22222222222223,
      9.2962962962963,
      8.540975689348583,
      13,
      2,
      0,
      15,
      0.00738525390625,
      "paired exact sign test; ties omitted; unadjusted",
      0.05169677734375
    ],
    [
      "C60",
      "A_prime",
      "G2",
      "H0",
      "top1",
      10.00000000000001,
      3.055555555555554,
      13.05555555555556,
      8.888888888888888,
      7.500734825848037,
      13,
      2,
      0,
      15,
      0.00738525390625,
      "paired exact sign test; ties omitted; unadjusted",
      0.05169677734375
    ],
    [
      "C90",
      "A_prime",
      "G2",
      "H0",
      "top1",
      13.33333333333333,
      7.222222222222214,
      15.27777777777778,
      11.88888888888889,
      7.339703822674696,
      14,
      1,
      0,
      15,
      0.0009765625,
      "paired exact sign test; ties omitted; unadjusted",
      0.0087890625
    ],
    [
      "B",
      "A_prime",
      "G2",
      "H0",
      "top1",
      8.8888888888889,
      4.166666666666664,
      12.77777777777778,
      9.037037037037038,
      8.892525711037218,
      12,
      2,
      1,
      14,
      0.012939453125,
      "paired exact sign test; ties omitted; unadjusted",
      0.05169677734375
    ],
    [
      "C90",
      "C60",
      "G2",
      "H0",
      "top1",
      2.222222222222229,
      0.8333333333333286,
      4.444444444444443,
      3,
      3.120168222299838,
      12,
      1,
      2,
      13,
      0.00341796875,
      "paired exact sign test; ties omitted; unadjusted",
      0.02734375
    ],
    [
      "B",
      "C60",
      "G2",
      "H0",
      "top1",
      -1.111111111111114,
      -3.05555555555555,
      1.111111111111114,
      0.148148148148149,
      5.136868614749356,
      5,
      9,
      1,
      14,
      0.4239501953125,
      "paired exact sign test; ties omitted; unadjusted",
      0.847900390625
    ],
    [
      "B",
      "C90",
      "G2",
      "H0",
      "top1",
      -3.888888888888886,
      -5.55555555555555,
      -1.388888888888893,
      -2.851851851851852,
      5.138585004600031,
      2,
      13,
      0,
      15,
      0.00738525390625,
      "paired exact sign test; ties omitted; unadjusted",
      0.05169677734375
    ]
  ],
  "cell_types": [
    [
      "s",
      "s",
      "s",
      "s",
      "s",
      "s",
      "s",
      "s",
      "s",
      "s",
      "s",
      "s",
      "s",
      "s",
      "s",
      "s",
      "s"
    ],
    [
      "s",
      "s",
      "s",
      "s",
      "s",
      "n",
      "n",
      "n",
      "n",
      "n",
      "n",
      "n",
      "n",
      "n",
      "n",
      "s",
      "n"
    ],
    [
      "s",
      "s",
      "s",
      "s",
      "s",
      "n",
      "n",
      "n",
      "n",
      "n",
      "n",
      "n",
      "n",
      "n",
      "n",
      "s",
      "n"
    ],
    [
      "s",
      "s",
      "s",
      "s",
      "s",
      "n",
      "n",
      "n",
      "n",
      "n",
      "n",
      "n",
      "n",
      "n",
      "n",
      "s",
      "n"
    ],
    [
      "s",
      "s",
      "s",
      "s",
      "s",
      "n",
      "n",
      "n",
      "n",
      "n",
      "n",
      "n",
      "n",
      "n",
      "n",
      "s",
      "n"
    ],
    [
      "s",
      "s",
      "s",
      "s",
      "s",
      "n",
      "n",
      "n",
      "n",
      "n",
      "n",
      "n",
      "n",
      "n",
      "n",
      "s",
      "n"
    ],
    [
      "s",
      "s",
      "s",
      "s",
      "s",
      "n",
      "n",
      "n",
      "n",
      "n",
      "n",
      "n",
      "n",
      "n",
      "n",
      "s",
      "n"
    ],
    [
      "s",
      "s",
      "s",
      "s",
      "s",
      "n",
      "n",
      "n",
      "n",
      "n",
      "n",
      "n",
      "n",
      "n",
      "n",
      "s",
      "n"
    ],
    [
      "s",
      "s",
      "s",
      "s",
      "s",
      "n",
      "n",
      "n",
      "n",
      "n",
      "n",
      "n",
      "n",
      "n",
      "n",
      "s",
      "n"
    ],
    [
      "s",
      "s",
      "s",
      "s",
      "s",
      "n",
      "n",
      "n",
      "n",
      "n",
      "n",
      "n",
      "n",
      "n",
      "n",
      "s",
      "n"
    ],
    [
      "s",
      "s",
      "s",
      "s",
      "s",
      "n",
      "n",
      "n",
      "n",
      "n",
      "n",
      "n",
      "n",
      "n",
      "n",
      "s",
      "n"
    ]
  ],
  "number_formats": {},
  "merged_ranges": [],
  "sheet_state": "visible",
  "freeze_panes": null,
  "header_rows": [
    1
  ],
  "row_policy": "All rows within worksheet dimensions, including blank and note rows, are retained.",
  "column_widths": {},
  "row_heights": {}
}
