{
  "name": "Fig4d_destination_per_run",
  "max_row": 16,
  "max_column": 9,
  "rows": [
    [
      "protocol",
      "seed",
      "n_queries",
      "correct",
      "adjacent_error",
      "nonadjacent_error",
      "correct_pct",
      "adjacent_error_pct",
      "nonadjacent_error_pct"
    ],
    [
      "H0",
      41,
      540,
      477,
      32,
      31,
      88.33333333333333,
      5.925925925925926,
      5.74074074074074
    ],
    [
      "H0",
      581,
      540,
      466,
      47,
      27,
      86.29629629629629,
      8.703703703703704,
      5
    ],
    [
      "H0",
      1121,
      540,
      468,
      42,
      30,
      86.66666666666667,
      7.777777777777778,
      5.555555555555555
    ],
    [
      "H0",
      1661,
      540,
      472,
      41,
      27,
      87.4074074074074,
      7.592592592592593,
      5
    ],
    [
      "H0",
      2201,
      540,
      471,
      44,
      25,
      87.22222222222223,
      8.148148148148149,
      4.62962962962963
    ],
    [
      "H2",
      41,
      540,
      414,
      94,
      32,
      76.66666666666667,
      17.40740740740741,
      5.925925925925926
    ],
    [
      "H2",
      581,
      540,
      410,
      101,
      29,
      75.92592592592592,
      18.7037037037037,
      5.37037037037037
    ],
    [
      "H2",
      1121,
      540,
      418,
      91,
      31,
      77.4074074074074,
      16.85185185185185,
      5.74074074074074
    ],
    [
      "H2",
      1661,
      540,
      402,
      111,
      27,
      74.44444444444444,
      20.55555555555556,
      5
    ],
    [
      "H2",
      2201,
      540,
      408,
      106,
      26,
      75.55555555555556,
      19.62962962962963,
      4.814814814814815
    ],
    [
      "H8",
      41,
      540,
      331,
      156,
      53,
      61.2962962962963,
      28.88888888888889,
      9.814814814814817
    ],
    [
      "H8",
      581,
      540,
      318,
      166,
      56,
      58.88888888888889,
      30.74074074074074,
      10.37037037037037
    ],
    [
      "H8",
      1121,
      540,
      327,
      159,
      54,
      60.55555555555556,
      29.44444444444444,
      10
    ],
    [
      "H8",
      1661,
      540,
      315,
      172,
      53,
      58.33333333333334,
      31.85185185185185,
      9.814814814814817
    ],
    [
      "H8",
      2201,
      540,
      323,
      172,
      45,
      59.81481481481482,
      31.85185185185185,
      8.333333333333334
    ]
  ],
  "cell_types": [
    [
      "s",
      "s",
      "s",
      "s",
      "s",
      "s",
      "s",
      "s",
      "s"
    ],
    [
      "s",
      "n",
      "n",
      "n",
      "n",
      "n",
      "n",
      "n",
      "n"
    ],
    [
      "s",
      "n",
      "n",
      "n",
      "n",
      "n",
      "n",
      "n",
      "n"
    ],
    [
      "s",
      "n",
      "n",
      "n",
      "n",
      "n",
      "n",
      "n",
      "n"
    ],
    [
      "s",
      "n",
      "n",
      "n",
      "n",
      "n",
      "n",
      "n",
      "n"
    ],
    [
      "s",
      "n",
      "n",
      "n",
      "n",
      "n",
      "n",
      "n",
      "n"
    ],
    [
      "s",
      "n",
      "n",
      "n",
      "n",
      "n",
      "n",
      "n",
      "n"
    ],
    [
      "s",
      "n",
      "n",
      "n",
      "n",
      "n",
      "n",
      "n",
      "n"
    ],
    [
      "s",
      "n",
      "n",
      "n",
      "n",
      "n",
      "n",
      "n",
      "n"
    ],
    [
      "s",
      "n",
      "n",
      "n",
      "n",
      "n",
      "n",
      "n",
      "n"
    ],
    [
      "s",
      "n",
      "n",
      "n",
      "n",
      "n",
      "n",
      "n",
      "n"
    ],
    [
      "s",
      "n",
      "n",
      "n",
      "n",
      "n",
      "n",
      "n",
      "n"
    ],
    [
      "s",
      "n",
      "n",
      "n",
      "n",
      "n",
      "n",
      "n",
      "n"
    ],
    [
      "s",
      "n",
      "n",
      "n",
      "n",
      "n",
      "n",
      "n",
      "n"
    ],
    [
      "s",
      "n",
      "n",
      "n",
      "n",
      "n",
      "n",
      "n",
      "n"
    ],
    [
      "s",
      "n",
      "n",
      "n",
      "n",
      "n",
      "n",
      "n",
      "n"
    ]
  ],
  "number_formats": {},
  "merged_ranges": [],
  "sheet_state": "visible",
  "freeze_panes": null,
  "header_rows": [
    1
  ],
  "row_policy": "All rows within worksheet dimensions, including blank and note rows, are retained.",
  "column_widths": {},
  "row_heights": {}
}
