{
  "name": "Fig6c_TableS6",
  "max_row": 12,
  "max_column": 8,
  "rows": [
    [
      "Protocol",
      "Comparison (first vs second)",
      "Top-1 first (%)",
      "Top-1 second (%)",
      "n10",
      "n01",
      "Exact P",
      "Holm-adjusted P"
    ],
    [
      "H0",
      "Projection residual vs Bayes-marginal",
      88.3,
      91.3,
      8,
      24,
      0.007,
      0.051
    ],
    [
      "H2",
      "Projection residual vs Bayes-marginal",
      76.7,
      73.7,
      18,
      2,
      0.0004,
      0.004
    ],
    [
      "H2",
      "Projection residual vs Mahalanobis",
      76.7,
      70.7,
      51,
      19,
      0.00017,
      0.002
    ],
    [
      "H4",
      "Projection residual vs Bayes-marginal",
      74.8,
      78.1,
      5,
      23,
      0.00091,
      0.008
    ],
    [
      "H6",
      "Projection residual vs Mahalanobis",
      61.7,
      66.1,
      44,
      68,
      0.029,
      0.107
    ],
    [
      "H8",
      "Projection residual vs Mahalanobis",
      61.3,
      66.5,
      42,
      70,
      0.01,
      0.062
    ],
    [
      "H0",
      "Graph-regularized 1-NN vs Cosine 1-NN",
      88.7,
      88.9,
      2,
      3,
      1,
      1
    ],
    [
      "H2",
      "Graph-regularized 1-NN vs Cosine 1-NN",
      75.4,
      76.7,
      1,
      8,
      0.039,
      0.107
    ],
    [
      "H4",
      "Graph-regularized 1-NN vs Cosine 1-NN",
      74.1,
      75.6,
      1,
      9,
      0.021,
      0.107
    ],
    [
      "H6",
      "Graph-regularized 1-NN vs Cosine 1-NN",
      60.2,
      61.7,
      1,
      9,
      0.021,
      0.107
    ],
    [
      "H8",
      "Graph-regularized 1-NN vs Cosine 1-NN",
      59.4,
      61.3,
      1,
      11,
      0.006,
      0.051
    ]
  ],
  "cell_types": [
    [
      "s",
      "s",
      "s",
      "s",
      "s",
      "s",
      "s",
      "s"
    ],
    [
      "s",
      "s",
      "n",
      "n",
      "n",
      "n",
      "n",
      "n"
    ],
    [
      "s",
      "s",
      "n",
      "n",
      "n",
      "n",
      "n",
      "n"
    ],
    [
      "s",
      "s",
      "n",
      "n",
      "n",
      "n",
      "n",
      "n"
    ],
    [
      "s",
      "s",
      "n",
      "n",
      "n",
      "n",
      "n",
      "n"
    ],
    [
      "s",
      "s",
      "n",
      "n",
      "n",
      "n",
      "n",
      "n"
    ],
    [
      "s",
      "s",
      "n",
      "n",
      "n",
      "n",
      "n",
      "n"
    ],
    [
      "s",
      "s",
      "n",
      "n",
      "n",
      "n",
      "n",
      "n"
    ],
    [
      "s",
      "s",
      "n",
      "n",
      "n",
      "n",
      "n",
      "n"
    ],
    [
      "s",
      "s",
      "n",
      "n",
      "n",
      "n",
      "n",
      "n"
    ],
    [
      "s",
      "s",
      "n",
      "n",
      "n",
      "n",
      "n",
      "n"
    ],
    [
      "s",
      "s",
      "n",
      "n",
      "n",
      "n",
      "n",
      "n"
    ]
  ],
  "number_formats": {},
  "merged_ranges": [],
  "sheet_state": "visible",
  "freeze_panes": null,
  "header_rows": [
    1
  ],
  "row_policy": "All rows within worksheet dimensions, including blank and note rows, are retained.",
  "column_widths": {},
  "row_heights": {}
}
