{
  "name": "Fig7d_TableS11",
  "max_row": 9,
  "max_column": 8,
  "rows": [
    [
      "Network",
      "Query group",
      "Design",
      "H0",
      "H2",
      "H3",
      "H4",
      "H8"
    ],
    [
      "City D",
      "G1 (represented)",
      "A",
      "63.3 (478)",
      "47.8 (1347)",
      "63.3 (527)",
      "63.9 (337)",
      "47.8 (1341)"
    ],
    [
      "City D",
      "G1 (represented)",
      "B",
      "57.2 (802)",
      "56.7 (944)",
      "57.2 (802)",
      "57.2 (802)",
      "56.7 (959)"
    ],
    [
      "City D",
      "G2 (absent)",
      "A",
      "45.6 (1193)",
      "45.6 (1193)",
      "44.4 (1228)",
      "45.6 (1193)",
      "44.4 (1228)"
    ],
    [
      "City D",
      "G2 (absent)",
      "B",
      "53.3 (605)",
      "53.3 (605)",
      "53.3 (605)",
      "53.3 (615)",
      "53.3 (615)"
    ],
    [
      "Haining",
      "G1 (represented)",
      "A",
      "86.1 (0)",
      "61.7 (1820)",
      "86.1 (0)",
      "85.6 (0)",
      "62.8 (1817)"
    ],
    [
      "Haining",
      "G1 (represented)",
      "B",
      "81.1 (952)",
      "80.6 (1125)",
      "81.1 (952)",
      "81.1 (875)",
      "80.6 (1117)"
    ],
    [
      "Haining",
      "G2 (absent)",
      "A",
      "44.4 (2179)",
      "44.4 (2179)",
      "42.2 (2219)",
      "41.1 (2179)",
      "41.7 (2185)"
    ],
    [
      "Haining",
      "G2 (absent)",
      "B",
      "59.4 (1168)",
      "59.4 (1168)",
      "59.4 (1168)",
      "57.8 (1236)",
      "57.8 (1236)"
    ]
  ],
  "cell_types": [
    [
      "s",
      "s",
      "s",
      "s",
      "s",
      "s",
      "s",
      "s"
    ],
    [
      "s",
      "s",
      "s",
      "s",
      "s",
      "s",
      "s",
      "s"
    ],
    [
      "s",
      "s",
      "s",
      "s",
      "s",
      "s",
      "s",
      "s"
    ],
    [
      "s",
      "s",
      "s",
      "s",
      "s",
      "s",
      "s",
      "s"
    ],
    [
      "s",
      "s",
      "s",
      "s",
      "s",
      "s",
      "s",
      "s"
    ],
    [
      "s",
      "s",
      "s",
      "s",
      "s",
      "s",
      "s",
      "s"
    ],
    [
      "s",
      "s",
      "s",
      "s",
      "s",
      "s",
      "s",
      "s"
    ],
    [
      "s",
      "s",
      "s",
      "s",
      "s",
      "s",
      "s",
      "s"
    ],
    [
      "s",
      "s",
      "s",
      "s",
      "s",
      "s",
      "s",
      "s"
    ]
  ],
  "number_formats": {},
  "merged_ranges": [],
  "sheet_state": "visible",
  "freeze_panes": null,
  "header_rows": [
    1
  ],
  "row_policy": "All rows within worksheet dimensions, including blank and note rows, are retained.",
  "column_widths": {},
  "row_heights": {}
}
